Org Key,Event Key,Event Title,Topline,Headliner,Openers,Date(s),Time(s),Price/Admission,Age Restriction,Event Description,Staff/Artists,Category,Venue,Venue Info,Street Name,Address Line 2,City,State,Postal Code,Event Image URL,Location Link,Get Tickets,URL
0005,000035,Joywave,,,,TBD,Start time: 8:00 PM. Doors: 8:00 PM,,All Ages," Joywave has spent much of the past decade holding an aural mirror to society, concocting a distinctively modern approach towards pop music that is both organic and synthetic, much like our own day-to-day lives. The Rochester, NY-based band is now wrapping up work on their hugely anticipated third album, POSSESSION, due via Cultco Music/Hollywood Records in early 2020. Produced at Joywave’s own studio in Rochester by founder Daniel Armbruster, arranged by Armbruster and his fellow band members Joseph Morinelli, Paul Brenner, and Benjamin Bailey, and then mixed by Dan Grech-Marguerat (The Killers, Liam Gallagher, Lana Del Rey), advance tracks from the LP offer a clear display of the band’s evolution from the basement to the big stage, to their current role of full-fledged pop provocateurs, fearlessly assimilating genres, motifs, and big ideas into its own one-of-a-kind identity. Songs such as the unprecedented first single, “Like A Kennedy” or the haunting “Blank Slate” provide both commentary and catharsis by bridging the political with the personal, as Armbruster’s finely etched social commentaries ultimately give way to frank introspection.   “The album really focuses on control,” says Armbruster. “It examines it on a broader societal level but also on a very personal level, like, how do I gain control over my own life and experiences? We turn on the news now and it’s like, what is happening? How am I supposed to go to the grocery store or think about paying my bills or whatever mundane thing I need to do?”   Joywave first came together in 2010 to put live flesh on the bones of songwriter-multi-instrumentalist Armbruster’s original home recordings. A series of visionary mixtapes and EPs followed, as did Big Data’s RIAA gold certified 2013 single, “Dangerous (Feat. Joywave),” a #1 hit at Alternative radio as well as a top 10 multi-format smash. 2014’s HOW DO YOU FEEL? EP was fast followed by the band’s full-length debut album, HOW DO YOU FEEL NOW? The album spawned a string of multi-format hits and 2016’s innovative remix collection, SWISH. The following year saw CONTENT make a top 10 debut on Billboard’s “Heatseekers” chart upon its arrival, powered by the Alternative radio favorites, “It’s A Trip” and “Doubt.”   Joywave has proved just as prolific and popular on the road, performing countless headline dates, show-stealing sets at international festivals spanning Lollapalooza, Coachella, Bumbershoot, and the UK’s Reading/Leeds, and support runs with such artists as The Killers, Young the Giant, Foals, Walk the Moon, Bleachers, Metric, Thirty Seconds To Mars, Silversun Pickups and more. Indeed, the increased focus on live activity in turn fueled the POSSESSION sessions, the band’s increasingly complex interplay taking a bigger spotlight in the studio than ever before.   “I think this album reflects our live show a lot more than the first two records did,” Armbruster says. “I still wrote all the songs but the process has become a lot more inclusive. The first record was really something that I wrote in my parents’ basement. The second record was also pretty closed, but now, with this new one, I got all the songs to a point and then really opened things up to the rest of the band. It’s kind of a big step for me actually, to say, Okay, I don’t have to micro-micromanage everything. Now I only have to micromanage. I’ve gone from nano-managing to micromanaging.”   Though not quite finished, it is already abundantly clear POSSESSION will prove a milestone for Joywave, evinced by such extraordinary new tracks as the aforementioned “Like A Kennedy,” the band’s first-ever ballad and perhaps most startlingly original moment thus far. Wedding a strikingly transgressive lyric to a simple melody and tender vocals, the song looks back into history to confront our current polarization, desensitization, and information overload, culminating with a symphonic guitar solo seemingly pulled out of some lost FM broadcast from 1976.   “It’s a media burnout song,” Armbruster says. “It’s anti-chaos. It’s encouraging people to zoom out. Unfortunately I think that everyone will fit it to a political narrative because that’s where society is at right now. It’s not really taking a stand – it’s more like, just stop all the crazy shit. We’re constantly told, this is what’s happening, what do you think about it? But I don’t know. I just want to be fat, old, and happy.”   “Basically the violence just happens over and over and over again,” Armbruster says about the video for “Like A Kennedy.” “There are four or five assassinations throughout the video and each time that I’m shot nobody reacts. It’s like putting the Zapruder film into 2019, where nobody is surprised by the violence and no action is taken each time that it occurs. The violence is allowed to just continue and continue and continue. Obviously that is very relevant to where we’re at now. Every time there’s another mass shooting, all these people die, and you know, thoughts and prayers. And nothing changes. It’s amazing to me that we had a president be the victim of gun violence and still the legislative bodies refused to make any type of meaningful change.”   “Obsession” looks to be another highlight of POSSESSION, its irresistible dance-pop expertly  “encapsulating the history of Joywave into one track,” says Armbruster. “I think that this new record is – hopefully – going to elevate the band and introduce us to a new audience so I thought it was important to catch people up in one song as to what the band has done up till now. It’s like the Cliff’s Notes version of where the band has been. I think it sums us up very well.”   Even at this early stage, it is impossible to view POSSESSION as anything other than a giant leap forward for Joywave, a boldly ambitious work that pushes an already visionary band across ever level, from songcraft and band interaction to freedom of influence, and most of all, perspective.   “One of the ideas on the record is being able to zoom out and have people back out of corners and back out of talking points,” says Daniel Armbruster. “I’m making a three dimensional line where people are able to zoom out enough to see what’s happening and be able to use rational thought. I’m not trying to go left or right – I’m trying to move forward. I’m trying to go up.”  ",,Performance,Trees Dallas,Night Club,2709 Elm Street,",","Dallas,",TX,75226,https://i.axs.com/2020/01/joywave_01-06-20_19_5e136552587c6.jpg,,https://www.axs.com/events/395188/joywave-tickets?skin=treesdallas,https://www.treesdallas.com/events/detail/395188
0005,000036,Mushroomhead,,,UnSaid Fate,TBD,Start time: 8:00 PM. Doors: 8:00 PM,,All Ages," 						Mushroomhead - are one of the most unique and adventurous alternative metal bands working today. Known for their stunningly theatrical live show and artsy masks, this innovative band has forged new ground in the rock world and influenced many other bands to push the envelope and bring art into rock. Formed in the early-1990s in Cleveland Ohio, the band’s combination of metal, rock and atmospheric elements has struck a chord with thousands of fans worldwide.   Mushroomhead have been performing incognito since 1993, when drummer Skinny founded the band. The band was meant to be a side-project so they wore masks to go unrecognized, but after only a few shows they developed a rabid and loyal fan base in Cleveland. Mushroomhead released their 1995 self-titled debut album independently and it went on to became an underground hit. This was history in the making because the band really had no proper distribution. Superbuick followed in 1996 and M3 in 1999, all released via an underground street effort. After the band felt its image and hyper-melodic, heavy style of music was being diluted by other bands jumping into this space, the band started to change their look to reflect nothing out there. After a brief stint on Eclipse Records, a move to Universal Records saw the release of XX (a combination of the past independent releases) in 2001 and XIII in 2003. The band’s last album sold over 200,000 units in the USA alone. Mushroomhead released Savior Sorrow for the pioneering rock label, Megaforce Records (Metallica, Anthrax, Ministry, Warren Haynes, Bad Brains) in 2006. Mushroomhead released “Beautiful Stories for Ugly Children” in the Fall of 2010 and it debuted at #44 on Billboard charts.  It can be said that Mushroomhead’s musical ascendance was a singular, original, aesthetic of eight guys decked out in matching jumpsuits and artsy masks, playing unbelievable, unsettling music. No other band was wearing masks and jumpsuits and purveying this type of ultra-melodic, ultra-dynamic music at the time – Mushroomhead sounded like nothing else. The band’s merging of metal, atmospheric elements, rock, and theatrics mixed with a punk DIY attitude has inspired and spawned other bands. Even though Mushroomhead’s music is rock-leaning in thought, the group remains firmly committed to pushing the envelope and trying new things. Influences range from the driving rhythms and breakneck turns of Pantera, to the dark melodies of Faith No More, to the atmospheric stylings of Pink Floyd, but all done in Mushroomhead style. ",,Performance,Trees Dallas,Night Club,2709 Elm Street,",","Dallas,",TX,75226,https://i.axs.com/mushroomhead_10-30-13_19_5271417f51822.jpg,,https://www.axs.com/events/395599/mushroomhead-tickets?skin=treesdallas,https://www.treesdallas.com/events/detail/395599
0006,000000,The 12 Days of Christmas,,,,"['Tuesday, November 24', 'Wednesday, November 25', 'Friday, November 27', 'Saturday, November 28', 'Sunday, November 29', 'Monday, November 30', 'Tuesday, December 1', 'Wednesday, December 2', 'Thursday, December 3', 'Friday, December 4', 'Saturday, December 5', 'Sunday, December 6', 'Monday, December 7', 'Tuesday, December 8', 'Wednesday, December 9', 'Thursday, December 10', 'Friday, December 11', 'Saturday, December 12', 'Sunday, December 13', 'Monday, December 14', 'Tuesday, December 15', 'Wednesday, December 16', 'Thursday, December 17', 'Friday, December 18', 'Saturday, December 19', 'Sunday, December 20', 'Monday, December 21', 'Tuesday, December 22', 'Wednesday, December 23', 'Thursday, December 24', 'Saturday, December 26', 'Sunday, December 27', 'Monday, December 28', 'Tuesday, December 29', 'Wednesday, December 30', 'Thursday, December 31']","['9am-5pm', '9am-5pm', '9am-5pm', '9am-5pm', '9am-5pm', '9am-5pm', '9am-5pm', '9am-5pm', '9am-5pm', '9am-5pm', '9am-5pm', '9am-5pm', '9am-5pm', '9am-5pm', '9am-5pm', '9am-5pm', '9am-5pm', '9am-5pm', '9am-5pm', '9am-5pm', '9am-5pm', '9am-5pm', '9am-5pm', '9am-5pm', '9am-5pm', '9am-5pm', '9am-5pm', '9am-5pm', '9am-5pm', '9am-5pm', '9am-5pm', '9am-5pm', '9am-5pm', '9am-5pm', '9am-5pm', '9am-5pm']",,,"From November 7–December 31, The 12 Days of Christmas features Victorian-style gazebos modeled after the beloved carol.",,Science and Nature,,Botanical Garden,8525 Garland Road,",",Dallas,TX,75218,"https://dallasarboretum.imgix.net/wp-content/uploads/2019/10/29165141/S0560_5D37182_Day12_v0001editcrop.jpg?fit=crop&crop=entropy,faces,center&q=70&auto=format&or=0&fm=jpeg&w=800&h=500",,['https://reservations.dallasarboretum.org/Info.aspx?EventID=3'],https://www.dallasarboretum.org/event/the-12-days-of-christmas/
0006,000001,Daily Harvest,,,,"['Tuesday, November 24', 'Tuesday, December 1', 'Thursday, December 3', 'Tuesday, December 8', 'Thursday, December 10', 'Tuesday, December 15', 'Thursday, December 17', 'Tuesday, December 22', 'Thursday, December 24', 'Tuesday, December 29', 'Thursday, December 31']","['10am-10:30am', '10am-10:30am', '10am-10:30am', '10am-10:30am', '10am-10:30am', '10am-10:30am', '10am-10:30am', '10am-10:30am', '10am-10:30am', '10am-10:30am', '10am-10:30am']",Included with garden admission or membership,,Join our horticulture team as they harvest fresh and seasonal produce in the garden every Tuesday and Thursday.,,Science and Nature,A Tasteful Place @ The Dallas Arboretum,Botanical Garden,8525 Garland Road,",",Dallas,TX,75218,"https://dallasarboretum.imgix.net/wp-content/uploads/2019/11/15141006/atp_test_pavilion800.jpg?fit=crop&crop=entropy,faces,center&q=70&auto=format&or=0&fm=jpeg&w=800&h=500",,[],https://www.dallasarboretum.org/event/daily-harvest/
0006,000002,Tasteful Tuesdays,,,,"['Tuesday, November 24', 'Tuesday, December 1', 'Tuesday, December 15', 'Tuesday, December 22', 'Tuesday, December 29']","['11am-12pm', '11am-12pm', '11am-12pm', '11am-12pm', '11am-12pm']",Included with garden admission or membership,,Learn from the pros as they teach you how to work with flowers.,,Science and Nature,A Tasteful Place @ The Dallas Arboretum,Botanical Garden,8525 Garland Road,",",Dallas,TX,75218,"https://dallasarboretum.imgix.net/wp-content/uploads/2019/08/06185006/GS_Flowers1.jpg?fit=crop&crop=entropy,faces,center&q=70&auto=format&or=0&fm=jpeg&w=800&h=500",,[],https://www.dallasarboretum.org/event/tasteful-tuesdays/
0006,000003,Harvest Tea,,,,"['Tuesday, November 24', 'Tuesday, November 24', 'Wednesday, November 25', 'Wednesday, November 25']","['11am-1pm', '2pm-4pm', '11am-1pm', '2pm-4pm']",$49.00 for Adult Tea$59.00 for Champagne Tea -Adult,,"September 21st - November 25th, 2020  Monday - Friday only, 11am & 2pm: For Teas questions call 214-515-6511 or email  Teas@dallasarboretum.org.",,Science and Nature,DeGolyer Restaurant @ The Dallas Arboretum,Botanical Garden,8525 Garland Road,",",Dallas,TX,75218,"https://dallasarboretum.imgix.net/wp-content/uploads/2019/11/22112049/Harvet20Tea20pic.jpg?fit=crop&crop=entropy,faces,center&q=70&auto=format&or=0&fm=jpeg&w=800&h=500",,"['https://reservations.dallasarboretum.org/Info.aspx?ActivityID=30&Date=11/24/2020 11:00AM&SkipDate=Yes&SkipTime=Yes', 'https://reservations.dallasarboretum.org/Info.aspx?ActivityID=30&Date=11/24/2020 02:00PM&SkipDate=Yes&SkipTime=Yes', 'https://reservations.dallasarboretum.org/Info.aspx?ActivityID=30&Date=11/25/2020 11:00AM&SkipDate=Yes&SkipTime=Yes', 'https://reservations.dallasarboretum.org/Info.aspx?ActivityID=30&Date=11/25/2020 02:00PM&SkipDate=Yes&SkipTime=Yes']",https://www.dallasarboretum.org/event/harvest-tea/
0006,000004,The 12 Days of Christmas at Night,,,,"['Wednesday, November 25', 'Friday, November 27', 'Saturday, November 28', 'Sunday, November 29', 'Monday, November 30', 'Tuesday, December 1', 'Wednesday, December 2', 'Thursday, December 3', 'Friday, December 4', 'Saturday, December 5', 'Sunday, December 6', 'Monday, December 7', 'Tuesday, December 8', 'Wednesday, December 9', 'Thursday, December 10', 'Friday, December 11', 'Saturday, December 12', 'Sunday, December 13', 'Monday, December 14', 'Tuesday, December 15', 'Wednesday, December 16', 'Thursday, December 17', 'Friday, December 18', 'Saturday, December 19', 'Sunday, December 20', 'Monday, December 21', 'Tuesday, December 22', 'Wednesday, December 23', 'Saturday, December 26', 'Sunday, December 27', 'Monday, December 28', 'Tuesday, December 29', 'Wednesday, December 30']","['6pm-9pm', '6pm-10pm', '6pm-10pm', '6pm-9pm', '6pm-9pm', '6pm-9pm', '6pm-9pm', '6pm-10pm', '6pm-10pm', '6pm-10pm', '6pm-9pm', '6pm-9pm', '6pm-9pm', '6pm-9pm', '6pm-10pm', '6pm-10pm', '6pm-10pm', '6pm-9pm', '6pm-9pm', '6pm-9pm', '6pm-9pm', '6pm-10pm', '6pm-10pm', '6pm-10pm', '6pm-9pm', '6pm-9pm', '6pm-9pm', '6pm-9pm', '6pm-10pm', '6pm-9pm', '6pm-9pm', '6pm-9pm', '6pm-9pm']",,,"From November 11–25 & November 27–December 30, The 12 Days of Christmas at Night features the beloved gazebos. ",,Science and Nature,,Botanical Garden,8525 Garland Road,",",Dallas,TX,75218,"https://dallasarboretum.imgix.net/wp-content/uploads/2019/11/25120013/12daysofchristmasatnight80022.jpg?fit=crop&crop=entropy,faces,center&q=70&auto=format&or=0&fm=jpeg&w=800&h=500",,['https://reservations.dallasarboretum.org/Info.aspx?EventID=13'],https://www.dallasarboretum.org/event/the-12-days-of-christmas-at-night/
0006,000005,Shop Local Friday,,,,[],[],Included with admission or membership,,"Nov. 27 from 10am–2pmDiscover local vendors and shop for jewelry, crafts, art, food & drinks and more!",,Science and Nature,Main Garden @ The Dallas Arboretum,Botanical Garden,8525 Garland Road,",",Dallas,TX,75218,"https://dallasarboretum.imgix.net/wp-content/uploads/2020/11/18134440/%40earthyandwhimsical-POPUP-Dallas-Arboretum-00.jpg?fit=crop&crop=entropy,faces,center&q=70&auto=format&or=0&fm=jpeg&w=800&h=500",,[],https://www.dallasarboretum.org/event/shop-local-friday/
